root@comp3134-winter2022-cybersecurity:~# tcpdump -r 0001.pcap 
reading from file 0001.pcap, link-type EN10MB (Ethernet)
00:13:45.094087 IP comp3134-winter2022-cybersecurity.ssh > 162.243.188.66.60966: Flags [P.], seq 3939103244:3939103308, ack 1906756315, win 501, options [nop,nop,TS val 3913201839 ecr 2117642620], length 64
00:13:45.094201 IP comp3134-winter2022-cybersecurity.ssh > 162.243.188.66.60966: Flags [P.], seq 64:192, ack 1, win 501, options [nop,nop,TS val 3913201839 ecr 2117642620], length 128
00:13:45.094317 IP comp3134-winter2022-cybersecurity.ssh > 162.243.188.66.60966: Flags [P.], seq 192:256, ack 1, win 501, options [nop,nop,TS val 3913201840 ecr 2117642620], length 64
00:13:45.096422 IP 162.243.188.66.60966 > comp3134-winter2022-cybersecurity.ssh: Flags [.], ack 0, win 2087, options [nop,nop,TS val 2117642639 ecr 3913201829], length 0
00:13:45.107311 IP 162.243.188.66.60966 > comp3134-winter2022-cybersecurity.ssh: Flags [.], ack 64, win 2087, options [nop,nop,TS val 2117642650 ecr 3913201839], length 0
