root@comp3134-winter2022-cybersecurity:~# tcpdump -c 5 -i eth0 port 22
tcpdump: verbose output suppressed, use -v or -vv for full protocol decode
listening on eth0, link-type EN10MB (Ethernet), capture size 262144 bytes
00:19:31.180942 IP comp3134-winter2022-cybersecurity.ssh > 162.243.188.66.60966: Flags [P.], seq 3940733676:3940733804, ack 1906763355, win 501, options [nop,nop,TS val 3913547926 ecr 2117988708], length 128
00:19:31.181148 IP comp3134-winter2022-cybersecurity.ssh > 162.243.188.66.60966: Flags [P.], seq 128:192, ack 1, win 501, options [nop,nop,TS val 3913547926 ecr 2117988708], length 64
00:19:31.181336 IP comp3134-winter2022-cybersecurity.ssh > 162.243.188.66.60966: Flags [P.], seq 192:320, ack 1, win 501, options [nop,nop,TS val 3913547927 ecr 2117988708], length 128
00:19:31.181472 IP comp3134-winter2022-cybersecurity.ssh > 162.243.188.66.60966: Flags [P.], seq 320:384, ack 1, win 501, options [nop,nop,TS val 3913547927 ecr 2117988708], length 64
00:19:31.182689 IP 162.243.188.66.60966 > comp3134-winter2022-cybersecurity.ssh: Flags [.], ack 0, win 2087, options [nop,nop,TS val 2117988725 ecr 3913547914], length 0
5 packets captured
11 packets received by filter
0 packets dropped by kernel
