root@comp3134-winter2022-cybersecurity:~# tcpdump -c 5 -i eth0
tcpdump: verbose output suppressed, use -v or -vv for full protocol decode
listening on eth0, link-type EN10MB (Ethernet), capture size 262144 bytes
23:55:38.285850 IP 162.243.188.66.60966 > comp3134-winter2022-cybersecurity.ssh: Flags [.], ack 3930142636, win 501, options [nop,nop,TS val 2116555825 ecr 3912115010], length 0
23:55:38.286354 IP comp3134-winter2022-cybersecurity.ssh > 162.243.188.66.60966: Flags [P.], seq 1:129, ack 0, win 502, options [nop,nop,TS val 3912115032 ecr 2116555825], length 128
23:55:38.286468 IP comp3134-winter2022-cybersecurity.ssh > 162.243.188.66.60966: Flags [P.], seq 129:193, ack 0, win 502, options [nop,nop,TS val 3912115032 ecr 2116555825], length 64
23:55:38.286582 IP comp3134-winter2022-cybersecurity.ssh > 162.243.188.66.60966: Flags [P.], seq 193:321, ack 0, win 502, options [nop,nop,TS val 3912115032 ecr 2116555825], length 128
23:55:38.286669 IP comp3134-winter2022-cybersecurity.ssh > 162.243.188.66.60966: Flags [P.], seq 321:385, ack 0, win 502, options [nop,nop,TS val 3912115032 ecr 2116555825], length 64
5 packets captured
33 packets received by filter
1 packet dropped by kernel
