root@comp3134-winter2022-cybersecurity:~# tcpdump -c 5 -i eth0 tcp
tcpdump: verbose output suppressed, use -v or -vv for full protocol decode
listening on eth0, link-type EN10MB (Ethernet), capture size 262144 bytes
00:18:22.733937 IP comp3134-winter2022-cybersecurity.ssh > 162.243.188.66.60966: Flags [P.], seq 3940730332:3940730460, ack 1906762523, win 501, options [nop,nop,TS val 3913479479 ecr 2117920259], length 128
00:18:22.734087 IP comp3134-winter2022-cybersecurity.ssh > 162.243.188.66.60966: Flags [P.], seq 128:192, ack 1, win 501, options [nop,nop,TS val 3913479479 ecr 2117920259], length 64
00:18:22.734210 IP comp3134-winter2022-cybersecurity.ssh > 162.243.188.66.60966: Flags [P.], seq 192:320, ack 1, win 501, options [nop,nop,TS val 3913479479 ecr 2117920259], length 128
00:18:22.734296 IP comp3134-winter2022-cybersecurity.ssh > 162.243.188.66.60966: Flags [P.], seq 320:384, ack 1, win 501, options [nop,nop,TS val 3913479480 ecr 2117920259], length 64
00:18:22.734976 IP 162.243.188.66.60966 > comp3134-winter2022-cybersecurity.ssh: Flags [.], ack 0, win 2087, options [nop,nop,TS val 2117920277 ecr 3913479467], length 0
5 packets captured
11 packets received by filter
0 packets dropped by kernel
