root@comp3134-winter2022-cybersecurity:~# tcpdump -c 5 -i eth0 src 138.197.139.235
tcpdump: verbose output suppressed, use -v or -vv for full protocol decode
listening on eth0, link-type EN10MB (Ethernet), capture size 262144 bytes
00:29:54.105064 IP comp3134-winter2022-cybersecurity.ssh > 162.243.188.66.60966: Flags [P.], seq 3946197820:3946197948, ack 1906785195, win 501, options [nop,nop,TS val 3914170850 ecr 2118611632], length 128
00:29:54.105206 IP comp3134-winter2022-cybersecurity.ssh > 162.243.188.66.60966: Flags [P.], seq 128:320, ack 1, win 501, options [nop,nop,TS val 3914170850 ecr 2118611632], length 192
00:29:54.105311 IP comp3134-winter2022-cybersecurity.ssh > 162.243.188.66.60966: Flags [P.], seq 320:384, ack 1, win 501, options [nop,nop,TS val 3914170851 ecr 2118611632], length 64
00:29:54.106308 IP comp3134-winter2022-cybersecurity.34497 > 67.207.67.2.domain: 61827+ [1au] PTR? 66.188.243.162.in-addr.arpa. (56)
00:29:54.106443 IP comp3134-winter2022-cybersecurity.58268 > 67.207.67.2.domain: 43492+ [1au] PTR? 66.188.243.162.in-addr.arpa. (56)
5 packets captured
31 packets received by filter
0 packets dropped by kernel
