root@comp3134-winter2022-cybersecurity:~# tcpdump -c 5  -n -i eth0
tcpdump: verbose output suppressed, use -v or -vv for full protocol decode
listening on eth0, link-type EN10MB (Ethernet), capture size 262144 bytes
00:17:23.935561 IP 138.197.139.235.22 > 162.243.188.66.60966: Flags [P.], seq 3940726140:3940726268, ack 1906760795, win 501, options [nop,nop,TS val 3913420681 ecr 2117861427], length 128
00:17:23.935718 IP 138.197.139.235.22 > 162.243.188.66.60966: Flags [P.], seq 128:192, ack 1, win 501, options [nop,nop,TS val 3913420681 ecr 2117861427], length 64
00:17:23.935862 IP 138.197.139.235.22 > 162.243.188.66.60966: Flags [P.], seq 192:320, ack 1, win 501, options [nop,nop,TS val 3913420681 ecr 2117861427], length 128
00:17:23.935979 IP 138.197.139.235.22 > 162.243.188.66.60966: Flags [P.], seq 320:384, ack 1, win 501, options [nop,nop,TS val 3913420681 ecr 2117861427], length 64
00:17:23.936314 IP 138.197.139.235.22 > 162.243.188.66.60966: Flags [P.], seq 384:624, ack 1, win 501, options [nop,nop,TS val 3913420682 ecr 2117861427], length 240
5 packets captured
9 packets received by filter
0 packets dropped by kernel
